{
  "schemaVersion": "1.1",
  "operational": {
    "canInspect": true,
    "canRemediate": false,
    "summary": "Some capabilities are implemented; see each entry."
  },
  "versions": {
    "core": "0.1.0",
    "detectors": [
      {
        "id": "pdf.metadata",
        "version": "1.1.0"
      },
      {
        "id": "pdf.annotations",
        "version": "1.0.0"
      },
      {
        "id": "pdf.form_fields",
        "version": "1.0.0"
      },
      {
        "id": "pdf.embedded_files",
        "version": "1.0.0"
      },
      {
        "id": "pdf.actions",
        "version": "1.0.0"
      },
      {
        "id": "pdf.text_layer",
        "version": "1.1.0"
      },
      {
        "id": "pdf.structure",
        "version": "1.0.0"
      },
      {
        "id": "image.exif",
        "version": "1.0.0"
      },
      {
        "id": "image.xmp",
        "version": "1.0.0"
      },
      {
        "id": "image.iptc",
        "version": "1.0.0"
      },
      {
        "id": "image.png_text",
        "version": "1.0.0"
      },
      {
        "id": "ocr.visible_text",
        "version": "0.4.1"
      }
    ]
  },
  "formats": [
    {
      "mediaType": "application/pdf",
      "detectors": [
        {
          "id": "pdf.metadata",
          "version": "1.1.0",
          "certainty": "deterministic",
          "emits": [
            "document_author",
            "document_creator",
            "document_producer",
            "document_title",
            "document_subject",
            "document_keywords",
            "document_timestamp"
          ],
          "status": "implemented",
          "adapter": "beforeshare-core::pdf (lopdf 0.45, ADR 0002)"
        },
        {
          "id": "pdf.annotations",
          "version": "1.0.0",
          "certainty": "deterministic",
          "emits": [
            "annotation"
          ],
          "status": "implemented",
          "adapter": "beforeshare-core::pdf (lopdf 0.45, ADR 0002)"
        },
        {
          "id": "pdf.form_fields",
          "version": "1.0.0",
          "certainty": "deterministic",
          "emits": [
            "form_field_name",
            "form_field_value"
          ],
          "status": "implemented",
          "adapter": "beforeshare-core::pdf (lopdf 0.45, ADR 0002)"
        },
        {
          "id": "pdf.embedded_files",
          "version": "1.0.0",
          "certainty": "deterministic",
          "emits": [
            "embedded_file"
          ],
          "status": "implemented",
          "adapter": "beforeshare-core::pdf (lopdf 0.45, ADR 0002)"
        },
        {
          "id": "pdf.actions",
          "version": "1.0.0",
          "certainty": "deterministic",
          "emits": [
            "document_javascript",
            "launch_action",
            "external_reference",
            "local_file_reference"
          ],
          "status": "implemented",
          "adapter": "beforeshare-core::pdf (lopdf 0.45, ADR 0002)"
        },
        {
          "id": "pdf.text_layer",
          "version": "1.1.0",
          "certainty": "deterministic",
          "emits": [
            "hidden_text",
            "text_under_redaction"
          ],
          "status": "implemented",
          "adapter": "beforeshare-core::pdf (lopdf 0.45, ADR 0002)"
        },
        {
          "id": "pdf.structure",
          "version": "1.0.0",
          "certainty": "deterministic",
          "emits": [
            "encryption_state",
            "permission_state",
            "digital_signature",
            "incremental_update"
          ],
          "status": "implemented",
          "adapter": "beforeshare-core::pdf (lopdf 0.45, ADR 0002)"
        },
        {
          "id": "ocr.visible_text",
          "version": "0.4.1",
          "certainty": "probabilistic",
          "emits": [
            "pii_email_address",
            "pii_phone_number",
            "pii_postal_address",
            "pii_geographic_coordinates",
            "pii_government_or_account_id",
            "pii_person_name",
            "pii_username_or_path",
            "pii_credential_like",
            "pii_user_defined_term"
          ],
          "status": "not_implemented",
          "waitingOn": "#6"
        }
      ],
      "actions": [
        {
          "action": "remove_pdf_metadata_field",
          "status": "not_implemented",
          "waitingOn": "#7"
        },
        {
          "action": "remove_annotations",
          "status": "not_implemented",
          "waitingOn": "#7"
        },
        {
          "action": "remove_embedded_files",
          "status": "not_implemented",
          "waitingOn": "#7"
        },
        {
          "action": "disable_javascript_and_launch_actions",
          "status": "not_implemented",
          "waitingOn": "#7"
        },
        {
          "action": "clear_form_values",
          "status": "not_implemented",
          "waitingOn": "#7"
        },
        {
          "action": "flatten_to_high_assurance_copy",
          "status": "not_implemented",
          "waitingOn": "#7"
        },
        {
          "action": "apply_visual_redaction",
          "status": "not_implemented",
          "waitingOn": "#7"
        }
      ],
      "testedLimits": {
        "status": "not_established",
        "reason": "No limit has been measured on a reference machine: limit-rules.json marks all four budgets provisional and names #56 as owing the numbers. A plausible figure here would be an untested limit published as a measurement."
      }
    },
    {
      "mediaType": "image/jpeg",
      "detectors": [
        {
          "id": "image.exif",
          "version": "1.0.0",
          "certainty": "deterministic",
          "emits": [
            "image_gps_coordinates",
            "image_device_make",
            "image_device_model",
            "image_software",
            "image_author",
            "image_capture_timestamp",
            "image_modification_timestamp",
            "image_embedded_thumbnail"
          ],
          "status": "not_implemented",
          "waitingOn": "#5"
        },
        {
          "id": "image.xmp",
          "version": "1.0.0",
          "certainty": "deterministic",
          "emits": [
            "image_author",
            "image_software",
            "image_metadata_comment"
          ],
          "status": "not_implemented",
          "waitingOn": "#5"
        },
        {
          "id": "image.iptc",
          "version": "1.0.0",
          "certainty": "deterministic",
          "emits": [
            "image_author",
            "image_metadata_comment"
          ],
          "status": "not_implemented",
          "waitingOn": "#5"
        },
        {
          "id": "ocr.visible_text",
          "version": "0.4.1",
          "certainty": "probabilistic",
          "emits": [
            "pii_email_address",
            "pii_phone_number",
            "pii_postal_address",
            "pii_geographic_coordinates",
            "pii_government_or_account_id",
            "pii_person_name",
            "pii_username_or_path",
            "pii_credential_like",
            "pii_user_defined_term"
          ],
          "status": "not_implemented",
          "waitingOn": "#6"
        }
      ],
      "actions": [
        {
          "action": "remove_image_metadata_field",
          "status": "not_implemented",
          "waitingOn": "#7"
        },
        {
          "action": "apply_visual_redaction",
          "status": "not_implemented",
          "waitingOn": "#7"
        }
      ],
      "testedLimits": {
        "status": "not_established",
        "reason": "No limit has been measured on a reference machine: limit-rules.json marks all four budgets provisional and names #56 as owing the numbers. A plausible figure here would be an untested limit published as a measurement."
      }
    },
    {
      "mediaType": "image/png",
      "detectors": [
        {
          "id": "image.exif",
          "version": "1.0.0",
          "certainty": "deterministic",
          "emits": [
            "image_gps_coordinates",
            "image_device_make",
            "image_device_model",
            "image_software",
            "image_author",
            "image_capture_timestamp",
            "image_modification_timestamp",
            "image_embedded_thumbnail"
          ],
          "status": "not_implemented",
          "waitingOn": "#5"
        },
        {
          "id": "image.xmp",
          "version": "1.0.0",
          "certainty": "deterministic",
          "emits": [
            "image_author",
            "image_software",
            "image_metadata_comment"
          ],
          "status": "not_implemented",
          "waitingOn": "#5"
        },
        {
          "id": "image.png_text",
          "version": "1.0.0",
          "certainty": "deterministic",
          "emits": [
            "image_software",
            "image_author",
            "image_metadata_comment"
          ],
          "status": "not_implemented",
          "waitingOn": "#5"
        },
        {
          "id": "ocr.visible_text",
          "version": "0.4.1",
          "certainty": "probabilistic",
          "emits": [
            "pii_email_address",
            "pii_phone_number",
            "pii_postal_address",
            "pii_geographic_coordinates",
            "pii_government_or_account_id",
            "pii_person_name",
            "pii_username_or_path",
            "pii_credential_like",
            "pii_user_defined_term"
          ],
          "status": "not_implemented",
          "waitingOn": "#6"
        }
      ],
      "actions": [
        {
          "action": "remove_image_metadata_field",
          "status": "not_implemented",
          "waitingOn": "#7"
        },
        {
          "action": "apply_visual_redaction",
          "status": "not_implemented",
          "waitingOn": "#7"
        }
      ],
      "testedLimits": {